{
  "screenshot_id": "c02c5b80-4997-406f-a7b8-0473a888111f",
  "name": "alignment_003_clean",
  "dimensions": {
    "width": 400,
    "height": 600
  },
  "components": [
    {
      "id": "comp_0",
      "type": "header",
      "label": "Settings",
      "bounding_box": {
        "x": 0.0,
        "y": 0.0,
        "w": 1.0,
        "h": 0.1
      },
      "bounding_box_px": {
        "x": 0,
        "y": 0,
        "width": 400,
        "height": 60
      },
      "confidence": 1.0,
      "attributes": {
        "text": "Settings",
        "visible": true,
        "is_issue": false,
        "issue_type": null
      }
    },
    {
      "id": "comp_1",
      "type": "text",
      "label": "Profile Settings",
      "bounding_box": {
        "x": 0.04,
        "y": 0.13333333333333333,
        "w": 0.3025,
        "h": 0.028333333333333332
      },
      "bounding_box_px": {
        "x": 16,
        "y": 80,
        "width": 121,
        "height": 17
      },
      "confidence": 1.0,
      "attributes": {
        "text": "Profile Settings",
        "visible": true,
        "is_issue": false,
        "issue_type": null
      }
    },
    {
      "id": "comp_2",
      "type": "text",
      "label": "Full Name",
      "bounding_box": {
        "x": 0.04,
        "y": 0.19166666666666668,
        "w": 0.14,
        "h": 0.015
      },
      "bounding_box_px": {
        "x": 16,
        "y": 115,
        "width": 56,
        "height": 9
      },
      "confidence": 1.0,
      "attributes": {
        "text": "Full Name",
        "visible": true,
        "is_issue": false,
        "issue_type": null
      }
    },
    {
      "id": "comp_3",
      "type": "input",
      "label": "John Doe",
      "bounding_box": {
        "x": 0.04,
        "y": 0.225,
        "w": 0.92,
        "h": 0.07333333333333333
      },
      "bounding_box_px": {
        "x": 16,
        "y": 135,
        "width": 368,
        "height": 44
      },
      "confidence": 1.0,
      "attributes": {
        "text": "John Doe",
        "visible": true,
        "is_issue": false,
        "issue_type": null
      }
    },
    {
      "id": "comp_4",
      "type": "text",
      "label": "Email Address",
      "bounding_box": {
        "x": 0.04,
        "y": 0.325,
        "w": 0.1975,
        "h": 0.015
      },
      "bounding_box_px": {
        "x": 16,
        "y": 195,
        "width": 79,
        "height": 9
      },
      "confidence": 1.0,
      "attributes": {
        "text": "Email Address",
        "visible": true,
        "is_issue": false,
        "issue_type": null
      }
    },
    {
      "id": "comp_5",
      "type": "input",
      "label": "john@example.com",
      "bounding_box": {
        "x": 0.04,
        "y": 0.35833333333333334,
        "w": 0.92,
        "h": 0.07333333333333333
      },
      "bounding_box_px": {
        "x": 16,
        "y": 215,
        "width": 368,
        "height": 44
      },
      "confidence": 1.0,
      "attributes": {
        "text": "john@example.com",
        "visible": true,
        "is_issue": false,
        "issue_type": null
      }
    },
    {
      "id": "comp_6",
      "type": "text",
      "label": "Phone Number",
      "bounding_box": {
        "x": 0.04,
        "y": 0.4583333333333333,
        "w": 0.2075,
        "h": 0.015
      },
      "bounding_box_px": {
        "x": 16,
        "y": 275,
        "width": 83,
        "height": 9
      },
      "confidence": 1.0,
      "attributes": {
        "text": "Phone Number",
        "visible": true,
        "is_issue": false,
        "issue_type": null
      }
    },
    {
      "id": "comp_7",
      "type": "input",
      "label": "Enter phone number",
      "bounding_box": {
        "x": 0.04,
        "y": 0.49166666666666664,
        "w": 0.92,
        "h": 0.07333333333333333
      },
      "bounding_box_px": {
        "x": 16,
        "y": 295,
        "width": 368,
        "height": 44
      },
      "confidence": 1.0,
      "attributes": {
        "text": "Enter phone number",
        "visible": true,
        "is_issue": false,
        "issue_type": null
      }
    },
    {
      "id": "comp_8",
      "type": "text",
      "label": "Preferences",
      "bounding_box": {
        "x": 0.04,
        "y": 0.6083333333333333,
        "w": 0.2425,
        "h": 0.021666666666666667
      },
      "bounding_box_px": {
        "x": 16,
        "y": 365,
        "width": 97,
        "height": 13
      },
      "confidence": 1.0,
      "attributes": {
        "text": "Preferences",
        "visible": true,
        "is_issue": false,
        "issue_type": null
      }
    },
    {
      "id": "comp_9",
      "type": "card",
      "label": null,
      "bounding_box": {
        "x": 0.04,
        "y": 0.6583333333333333,
        "w": 0.92,
        "h": 0.08333333333333333
      },
      "bounding_box_px": {
        "x": 16,
        "y": 395,
        "width": 368,
        "height": 50
      },
      "confidence": 1.0,
      "attributes": {
        "text": null,
        "visible": true,
        "is_issue": false,
        "issue_type": null
      }
    },
    {
      "id": "comp_10",
      "type": "text",
      "label": "Email Notifications",
      "bounding_box": {
        "x": 0.07,
        "y": 0.6783333333333333,
        "w": 0.29,
        "h": 0.016666666666666666
      },
      "bounding_box_px": {
        "x": 28,
        "y": 407,
        "width": 116,
        "height": 10
      },
      "confidence": 1.0,
      "attributes": {
        "text": "Email Notifications",
        "visible": true,
        "is_issue": false,
        "issue_type": null
      }
    },
    {
      "id": "comp_11",
      "type": "text",
      "label": "Receive updates via email",
      "bounding_box": {
        "x": 0.07,
        "y": 0.7083333333333334,
        "w": 0.36,
        "h": 0.02
      },
      "bounding_box_px": {
        "x": 28,
        "y": 425,
        "width": 144,
        "height": 12
      },
      "confidence": 1.0,
      "attributes": {
        "text": "Receive updates via email",
        "visible": true,
        "is_issue": false,
        "issue_type": null
      }
    },
    {
      "id": "comp_12",
      "type": "button",
      "label": "Save Changes",
      "bounding_box": {
        "x": 0.04,
        "y": 0.7833333333333333,
        "w": 0.92,
        "h": 0.08
      },
      "bounding_box_px": {
        "x": 16,
        "y": 470,
        "width": 368,
        "height": 48
      },
      "confidence": 1.0,
      "attributes": {
        "text": "Save Changes",
        "visible": true,
        "is_issue": false,
        "issue_type": null
      }
    },
    {
      "id": "comp_13",
      "type": "button",
      "label": "Cancel",
      "bounding_box": {
        "x": 0.04,
        "y": 0.8833333333333333,
        "w": 0.92,
        "h": 0.08
      },
      "bounding_box_px": {
        "x": 16,
        "y": 530,
        "width": 368,
        "height": 48
      },
      "confidence": 1.0,
      "attributes": {
        "text": "Cancel",
        "visible": true,
        "is_issue": false,
        "issue_type": null
      }
    }
  ],
  "component_count": 14,
  "component_types": [
    "button",
    "card",
    "header",
    "input",
    "text"
  ],
  "created": "2026-03-13T13:21:43.672929"
}